setTime,star,content,seg_result
1 個月前,5,VR鬼屋有夠讚 喉嚨直接破掉 服務也很讚但可惜我手機不是哀鳳沒有辦法存影片 哭了,鬼屋 喉嚨 直接 破掉 服務 可惜 手機 沒有 辦法 影片
1 個月前,5,Vr好還不錯很可怕,不錯 可怕
1 個月前,5,非常好玩 我要被嚇鼠了 超讚 體驗真的超棒 ,好玩 嚇鼠 體驗 超棒
1 個月前,5,內羅畢快車以嶺是個好導遊,內羅畢 快車 導遊
1 個月前,5,怡玲解說導覽很棒 幽默風趣,解說 導覽 幽默 風趣
1 個月前,5,鄭奕宏服務良好介紹園區也很專業讚,服務 良好 介紹 園區 專業
1 個月前,5,奕宏哥哥講解園區清楚 服務很好 好喜翻,哥哥 講解 園區 清楚 服務 喜翻
1 個月前,5,鄭奕宏熱心服務有專業能力,熱心 服務 專業 能力
1 個月前,5,鄭奕宏解說清楚態度親切棒棒 ,解說 清楚 態度 親切 棒棒
1 個月前,5,"鄭奕宏棒棒
服務貼心講解很完整有問必答","棒棒
 服務 貼心 講解 完整"
1 個月前,5,鄭奕宏服務很讚細心解說很親切一百分,服務 細心 解說 親切 一百
1 個月前,5,鄭奕宏 服務態度一百分 親切又貼心,服務 態度 一百 親切 貼心
1 個月前,5,鄭奕宏服務很好也很親切 ,服務 親切
1 個月前,5,弈宏人好好下次一定會再光臨 舒適的環境跟超優質的服務人員 ,光臨 舒適 環境 服務 人員
1 個月前,5,導覽員服務很好 超級友善,導覽員 服務 友善
1 個月前,5,摩天雨涵講解的非常好非常清楚可以讓遊客快速了解設施的好玩之處,摩天雨涵 講解 清楚 遊客 快速 了解 設施 好玩
1 個月前,5,摩天雨涵服務很好,摩天雨涵 服務
1 個月前,5,"摩天 雨涵
服務很好","涵
 服務"
1 個月前,5,北台灣好玩的主題遊樂園適合親子打發時間用親子時光無價啊玩好玩滿玩得好開心一票玩到底也可以跟玩玩蒸氣火車看動物園猛獸區巴士看大動物採礦列車急流泛舟旋轉木馬六福村主題遊樂園很值回票價,台灣 好玩 主題 遊樂園 適合 親子 打發 時間 親子 時光 無價 好玩 開心 蒸氣 火車 動物園 猛獸區 巴士 動物 採礦 列車 急流 泛舟 旋轉 木馬 六福村 主題 遊樂園 值回 票價
1 個月前,5,門票不便宜也不開晚一點時間都用在排隊了真正玩到的不到5樣,門票 便宜 一點 時間 排隊 玩到 不到
1 個月前,4,"十幾年沒有來了這次來還是一樣很舒服
猛獸區的動物也很配合全部都跑出來車子旁邊擺Pose ",十幾 一樣 舒服 猛獸區 動物 配合 全部 跑出來 車子 旁邊
1 個月前,5,,
1 個月前,5,,
1 個月前,5,售票人員楊美智服務親切提供優惠訊息,售票 人員 服務 親切 提供 優惠 訊息
1 個月前,5,4年後再玩樂園動物園列車解說詳盡連假人多遊樂動線不錯,樂園 動物園 列車 解說 詳盡 假人 遊樂 動線 不錯
1 個月前,3,我覺得園內設施在過去十幾年並沒有太多的變動除了動物園的部分覺得不錯以外遊樂設施不用期待太多整體來說如果是為了遊樂設施而想造訪的話我認為會很失望的,覺得 設施 過去 十幾 沒有 太多 變動 動物園 部分 覺得 不錯 以外 遊樂 設施 期待 太多 整體 遊樂 設施 造訪 認為 失望
2 個月前,5,童年的回憶也帶自己小孩來玩,童年 回憶 小孩
2 個月前,5,非常棒的遊樂園適合親子一起玩的地方除了遊樂設施也有動物園可以逛逛,遊樂園 適合 親子 地方 遊樂 設施 動物園 逛逛
2 個月前,4,很多主題,很多 主題
2 個月前,4,,
2 個月前,4,"萬聖節與六福村

萬聖節六福村的牛排館有午夜咒噩夢表演 ",萬聖節 六福村 萬聖節 六福村 牛排館 午夜咒 噩夢 表演
2 個月前,5,,
2 個月前,5,魔幻劇場舞台技巧與舞步編排精湛25分鐘演出節目緊湊與熱鬧,魔幻 劇場 舞台 技巧 舞步 編排 精湛 25 分鐘 演出 節目 緊湊 熱鬧
2 個月前,5,"VR雖然有點恐怖但真的很好玩
而且工作人員也都超親切超讚的
如果我是老闆會給他們加薪的程度
有機會會再來 ",恐怖 好玩 工作 人員 親切 老闆 加薪 程度 機會
2 個月前,5,VR要另外付費但很值得體驗服務人員非常親切,付費 值得 體驗 服務 人員 親切
2 個月前,5,一個與gd和朋友一起娛樂和玩樂的好地方看到真實的動物會增加獲取知識的能力,朋友 娛樂 玩樂 地方 看到 真實 動物 增加 獲取 知識 能力
2 個月前,5,美西雞排餐車 讚讚讚 ,美西雞 排餐車 讚讚
2 個月前,5,美西雞排餐車 員工很正 東西好吃 服務超貼切 還不去朝聖,美西 排餐車 員工 東西 好吃 服務 貼切 朝聖
2 個月前,5,美西雞排餐車 ,美西雞 排餐車
2 個月前,5,美西 雞排餐車,美西  雞排餐車
2 個月前,5,美西雞排餐車讚 ,美西雞 排餐車
2 個月前,5,美西雞排餐車,美西雞 排餐車
2 個月前,5,"雞排好吃 套餐超值
在美西的雞排餐車",雞排 好吃 套餐 超值 美西 雞排 餐車
2 個月前,5,"服務員笑傲雨涵介紹很好
讓我很放心 ",服務員 笑傲雨涵 介紹 放心
2 個月前,5,摩天蓬車服務員琬婷服務好好人好好好喜歡給她服務,摩天蓬車 服務員 服務 好人 好好 喜歡 服務
2 個月前,5,宋琬婷服務太棒了 一定是滿分 ,服務 滿分
2 個月前,5,讚宋琬婷讚讚我們很喜歡摩天摩車,讚讚 喜歡 摩天 摩車
2 個月前,5,笑傲飛鷹春香雨涵介紹很好,笑傲 飛鷹 介紹
2 個月前,5,Screaming condor 春香雨涵 服務非常好確保我的朋友沒事因為她感覺不舒服,春香 涵  服務 確保 朋友 感覺 舒服
2 個月前,5,今天來六福村玩遇到麗華服務員服務非常好有什麼問題都馬上幫我解決下次會再來玩的 ,今天 六福村 遇到 服務員 服務 問題 解決
2 個月前,5,笑傲飛鷹服務人員瑞玲和雨涵很棒介紹齊全認真,笑傲 飛鷹 服務 人員 介紹 齊全 認真
2 個月前,5,笑傲飛鷹服務人員 瑞玲 雨涵 態度親切 認真介紹任何遊樂設施 很棒 ,笑傲 飛鷹 服務 人員 態度 親切 認真 介紹 任何 遊樂 設施
2 個月前,3,,
2 個月前,5,,
2 個月前,5,,
2 個月前,5,魔幻劇場表演,魔幻 劇場 表演
2 個月前,5,魔幻劇場很精彩,魔幻 劇場 精彩
2 個月前,5,風火輪開放了變的更快更好好玩 ,風火輪 開放 好好玩
2 個月前,5,,
2 個月前,5,蒸汽火車遊園介紹秋玉很棒,蒸汽 火車 遊園 介紹
2 個月前,5,遊行很精彩,遊行 精彩
2 個月前,5,魔幻劇場很精彩,魔幻 劇場 精彩
2 個月前,5,魔幻劇場很棒,魔幻 劇場
2 個月前,5,敬媛導覽員態度良好動物照顧得很棒,導覽員 態度 良好 動物 照顧
2 個月前,5,摩天輪服務很好沅儒,摩天輪 服務
2 個月前,5,遊客中心的鍾小姐親切熱情一一回答我們購票的問題很有耐心讚讚,遊客 中心 小姐 親切 熱情 回答 問題 耐心 讚讚
2 個月前,5,"法老商店的店員很親切
服務態度良好",商店 店員 親切 服務 態度 良好
2 個月前,5,法老商店的店員很親切服務態度良好 ,商店 店員 親切 服務 態度 良好
2 個月前,1,買了兩張1199元的票入場 一堆設施故障關閉笑傲飛鷹大怒神獨木舟急流泛舟等等都沒開放有開放的設施又限制人數玩不到三樣,1199 入場 設施 故障 關閉 笑傲 飛鷹 怒神 獨木舟 急流 泛舟 開放 開放 設施 限制 人數
2 個月前,5,很謝謝旅遊服務中心旁邊門口服務員林思眉小姐熱心親切幫拍很多美美的照片幫我們在女兒6歲生日這一天留下特別美好的回憶,謝謝 旅遊 服務 中心 旁邊 門口 服務員 小姐 熱心 親切 很多 美美 照片 女兒 生日 留下 特別 美好 回憶
2 個月前,4,,
2 個月前,1,"東京迪士尼門票1900
台灣六福村1190
門票售這麼高就算了還一堆設施不開根本騙人進來有夠騙",東京 門票 1900 台灣 六福村 1190 門票 算了 設施 騙人 進來
2 個月前,5,,
2 個月前,5,葉凱文服務超棒超好玩,服務 超棒 好玩
2 個月前,5,動物很多猛獸區很像侏羅紀公園的大門很酷剛好遇到國中小高中的校外教學人很多,動物 很多 猛獸區 侏羅紀 公園 大門 遇到 國中 高中 教學人 很多
2 個月前,5,火山 佳伶 講解仔細 對客人非常有耐心 ,火山 講解 仔細 客人 耐心
2 個月前,5,今天玩火山佳伶服務熱情 還幫忙小朋友拉雨衣貼心服務 ,今天 火山 佳伶 服務 熱情 幫忙 小朋友 雨衣 貼心 服務
2 個月前,5,第一次在六福村參與嘉年華遊行非常有趣表演人員跟小朋友很多互動也很熱情 ,第一 六福村 參與 遊行 有趣 表演 人員 小朋友 很多 互動 熱情
2 個月前,5,,
2 個月前,5,"天馬行空
戴宏忠黃沛瑄
服務熱情
平日 ",天馬行空 服務 熱情 平日
2 個月前,5,工作人員雨涵非常熱心解說各項設施,工作 人員 熱心 解說 設施
2 個月前,5,採礦雨涵很熱情謝謝講解,採礦 雨涵 熱情 謝謝 講解
2 個月前,5,採礦雨涵熱心解說讚 ,採礦 雨涵 熱心 解說
2 個月前,5,採礦雨涵的服務超親切很有親和力,採礦 服務 親切 親和力
2 個月前,5,摩天蓬車睿霖服務很好,摩天蓬車 服務
2 個月前,5,"犀牛姊姊的勇闖猛獸島真的很值得
講解的很清楚
而且很幽默可愛還有親切",犀牛 姊姊 勇闖 值得 講解 清楚 幽默 可愛 親切
2 個月前,5,黑珍珠商店服務態度很好  ,商店 服務 態度
2 個月前,5,黑珍珠商店服務態度很好 很喜歡這裡的店員,商店 服務 態度 喜歡 這裡 店員
2 個月前,5,採礦車雨涵服務超棒又親切,採礦車 雨涵 服務 超棒 親切
2 個月前,5,"服務員亦良服務親切
服務員渝婷服務親切",服務員 服務 親切 服務員 服務 親切
2 個月前,5,"古墓的亦良
服務親切",服務 親切
2 個月前,5,古墓的渝婷服務親切,服務 親切
2 個月前,5,採礦雨涵很熱心地介紹我她推薦的設施還不錯,採礦 雨涵 熱心 介紹 推薦 設施 不錯
2 個月前,5,黑珍珠商店店員服務態度很好有機會還要再來,商店 店員 服務 態度 機會
2 個月前,5,採礦車雨涵很有耐心親切服務非常好 ,採礦車 耐心 親切 服務
2 個月前,5,採礦雨涵服務很好喔,採礦 雨涵 服務
2 個月前,5,"從小玩到大感覺設施不再那麼恐怖
很喜歡裡面的氛圍 ",小玩 感覺 設施 恐怖 喜歡 裡面 氛圍
2 個月前,5,"台灣新竹  六福村主題樂園 
這應該是大家童年回憶一定會有的景點吧
印象是國高中畢業旅行校外教學必安排的景點 ",台灣 新竹 六福村 主題 樂園 童年 回憶 景點 印象 國高中 畢業 旅行 教學 安排 景點
2 個月前,5,,
2 個月前,5,好玩開心的地方服務也用心,好玩 開心 地方 服務 用心
2 個月前,5,彩薇服務態度很好導覽解說也很好,服務 態度 導覽 解說
2 個月前,5,彩薇服務態度良好,服務 態度 良好
2 個月前,5,彩薇在蒸汽火車對動物的講解非常流暢精闢服務態度好,蒸汽 火車 動物 講解 流暢 精闢 服務 態度
2 個月前,5,採礦車服務員蘇渝婷服務好 還很熱心幫忙拍照 相當好的員工及服務態度,採礦車 服務員 服務 熱心 幫忙 拍照 員工 服務 態度
2 個月前,5,魔幻旅程 覺得很厲害,魔幻 旅程 覺得 厲害
2 個月前,5,依舊是台灣數一數二的遊樂園指的推薦,台灣 數一數二 遊樂園 推薦
2 個月前,5,服務中心淑庭,服務 中心
2 個月前,5,超好玩,好玩
2 個月前,5,,
2 個月前,5,好的,
2 個月前,5,介紹清楚很愉快的火車導覽,介紹 清楚 愉快 火車 導覽
2 個月前,5,六福村讚,六福村
2 個月前,5,非常專業,專業
2 個月前,5,,
2 個月前,5,秋玉妹妹的導覽非常生動有趣,妹妹 導覽 生動 有趣
2 個月前,5,邱鬱人很好,
2 個月前,5,,
2 個月前,5,,
2 個月前,5,彩薇 服務棒,服務棒
2 個月前,5,福記小廚,小廚
2 個月前,5,"六福村蒸汽火車
秋玉",六福村 蒸汽 火車
2 個月前,5,六福村蒸汽火車秋玉超棒,六福村 蒸汽 火車 超棒
2 個月前,5,蒸汽火車秋玉 ,蒸汽 火車
2 個月前,5,蒸氣火車秋玉專業,蒸氣 火車 專業
2 個月前,5,"蒸氣火車 很特別的經驗
解說員秋玉講解的很詳細",蒸氣 火車 特別 經驗 解說員 講解 詳細
2 個月前,5,六福村蒸汽火車推薦秋玉介紹園超棒,六福村 蒸汽 火車 推薦 介紹園 超棒
2 個月前,5,瑞璇導覽解說員講解非常清楚,導覽 解說員 講解 清楚
2 個月前,5,瑞璇導覽很好,導覽
2 個月前,5,,
2 個月前,5,張朕嘉大海怪服務很好,大海怪 服務
2 個月前,5,彩微小火車讚,微小 火車
2 個月前,5,彩薇小火車 讚讚,火車  讚讚
2 個月前,5,非常適合大人小孩 ,適合 大人 小孩
2 個月前,5,彩薇姐姐好專業,姐姐 專業
2 個月前,5,,
2 個月前,5,"謝謝園區人員
在我無助時
幫忙我 ",謝謝 園區 人員 無助 幫忙
2 個月前,5,,
2 個月前,5,蒸氣火車秋玉姐姐導覽親切讚,蒸氣 火車 姐姐 導覽 親切
2 個月前,5,蒸汽火車秋玉姐姐很棒,蒸汽 火車 姐姐
2 個月前,5,蒸氣火車秋玉導覽詳細有趣看到多種草食動物 ,蒸氣 火車 秋玉 導覽 詳細 有趣 看到 草食 動物
2 個月前,5,"蒸氣火車 秋玉
服務態度很好
講解很清楚","蒸氣 火車 秋玉
 服務 態度 講解 清楚"
2 個月前,5,蒸汽火車服務人員秋玉等人服務態度都非常棒,蒸汽 火車 服務 人員 服務 態度
2 個月前,5,"蒸汽火車秋玉
導覽非常棒 ",蒸汽 火車 導覽
2 個月前,5,蒸汽火車秋玉,蒸汽 火車
2 個月前,5,蒸氣火車 秋玉姐姐解釋很棒,蒸氣 火車 姐姐 解釋
2 個月前,5,與同事一起遊玩 服務台的俐君小姐跟沈課長用心幫我們解決問題 貼心,同事 遊玩 服務台 小姐 課長 用心 解決 問題 貼心
2 個月前,5,很讚 服務人員俐君很棒,服務 人員
2 個月前,5,"六福村已經是台灣最好玩的遊樂園
服務人員俐君親切推推 ",六福村 台灣 好玩 遊樂園 服務 人員 親切 推推
2 個月前,5,遊客服務中心的俐君人超級好,遊客 服務 中心
2 個月前,5,服務員俐君人真好,服務員
2 個月前,5,俐君服務超級好當天遇到一些狀況謝謝沈課和俐君的協助讓我們可以順利入園玩,服務 超級 當天 遇到 一些 狀況 謝謝 協助 順利 入園
2 個月前,5,第一次到六福村服務人員俐君超級親切,第一 六福村 服務 人員 親切
2 個月前,5,,
2 個月前,5,"導覽員 陳瑞璇
講解很生動 期待下次再來遊玩",導覽員 講解 生動 期待 遊玩
2 個月前,5,彩薇導覽很精彩辛苦了,導覽 精彩 辛苦
2 個月前,5,彩薇導覽清楚 小孩非常喜歡,導覽 清楚 小孩 喜歡
2 個月前,5,彩薇導覽很清楚,導覽 清楚
2 個月前,5,彩薇超棒的人很親切,超棒 親切
2 個月前,5,"一早入園玩旋轉木馬沒人都不用等超棒
品潔人超好幫我們照了一堆美照謝謝他","入園 旋轉 木馬 超棒
品 潔人 超好 美照 謝謝"
2 個月前,5,,
2 個月前,5,動物跟遊樂設施都有一定的水準,動物 遊樂 設施 水準
2 個月前,4,,
2 個月前,5,天馬宏忠熱情服務,天馬宏忠 熱情 服務
2 個月前,5,彩薇服務態度太好了介紹的很details,服務 態度 介紹
2 個月前,5,彩薇蒸汽火車一級棒,蒸汽 火車 一級棒
2 個月前,5,"蒸汽火車彩薇
服務態度超讚",蒸汽 火車 服務 態度
2 個月前,5,蒸汽火車彩薇,蒸汽 火車
2 個月前,5,陳彩薇小姐姐講解溫柔細心,小姐姐 講解 溫柔 細心
2 個月前,5,哈妮廚房的咖啡好喝環境好好,廚房 咖啡 環境 好好
2 個月前,5,"蒸氣火車 秋玉
非常親切
很棒 ",蒸氣 火車 親切
2 個月前,5,蒸汽火車秋玉講解的很詳細 ,蒸汽 火車 講解 詳細
2 個月前,5,秋玉導覽棒棒,導覽 棒棒
2 個月前,5,哈尼廚房飲料好好喝店員又親切讚,廚房 飲料 好好喝 店員 親切
2 個月前,5,哈妮廚房的飲料好好喝 ,廚房 飲料 好好
2 個月前,5,雷射迷宮超讚工作人員怡靜超棒 還協助我們拍照超喜歡她,雷射 迷宮 工作 人員 超棒  協助 拍照 喜歡
2 個月前,5,雷射迷宮好玩 賴怡靜協助拍照,雷射 迷宮 好玩 協助 拍照
2 個月前,5,"雷射迷宮好玩
服務人員協助拍照
賴怡靜 ",雷射 迷宮 好玩 服務 人員 協助 拍照
2 個月前,5,彩薇導覽解說非常棒,導覽 解說
2 個月前,5,好玩 可以看到很多動物,好玩 看到 很多 動物
2 個月前,5,導覽詳細 服務熱情,導覽 詳細 服務 熱情
2 個月前,5,"瘋狂馬戲嘉年華非常棒
只到319",瘋狂 馬戲 319
2 個月前,5,蒸汽火車秋玉導覽說明非常清楚活潑下次一定再來,蒸汽 火車 導覽 說明 清楚 活潑
2 個月前,5,劉怡玲講解細緻受益良多,講解 細緻 受益 良多
2 個月前,5,雷射迷宮好玩服務人員協助拍照賴怡靜,雷射 迷宮 好玩 服務 人員 協助 拍照
2 個月前,5,陳彩薇 很認真的在導覽說明 人也非常親切,認真 導覽 說明 親切
2 個月前,5,,
2 個月前,5,緗楹姐姐親切熱情介紹我們去很多好玩的地方,姐姐 親切 熱情 介紹 很多 好玩 地方
2 個月前,5,緗楹姊姊很認真告訴我們哪些設施好玩 跟服務態度很好很喜歡 ,姊姊 認真 告訴 哪些 設施 好玩 服務 態度 喜歡
2 個月前,5,魔幻劇場超棒很精彩超棒推薦,魔幻 劇場 精彩 超棒 推薦
2 個月前,5,緗楹姐姐服務很好告訴我們很多好玩的設施也很熱情,姐姐 服務 告訴 很多 好玩 設施 熱情
2 個月前,5,蒸汽火車好好玩 讚,蒸汽 火車 好好玩
2 個月前,5,秋玉介紹超專業,介紹 超專業
2 個月前,5,蒸汽火車導覽員秋玉非常熱情親切,蒸汽 火車 導覽員 熱情 親切
2 個月前,5,Vr 服務好超刺激的,服務 刺激
2 個月前,5,裡面的VR體驗超好玩可惜有點貴但我覺得很值得,裡面 體驗 好玩 可惜 覺得 值得
2 個月前,5,VR 好玩,好玩
2 個月前,5,"VR感覺很真實
好玩
很刺激
服務不錯",感覺 真實 好玩 刺激 服務 不錯
2 個月前,5,VR好玩有身歷其境的感覺服務也不錯,好玩 身歷其境 感覺 服務 不錯
2 個月前,5,,
2 個月前,5,怡玲解說導覽很詳細,解說 導覽 詳細
2 個月前,5,VR服務很好,服務
2 個月前,5,彩薇服務熱心專業,服務 熱心 專業
2 個月前,5,,
2 個月前,5,謝謝彩薇細心講解,謝謝 細心 講解
2 個月前,5,"天氣好超適合來玩火車導覽很棒
劉怡伶推推",天氣 好超 適合 火車 導覽 推推
2 個月前,5,蒸汽火車怡玲介紹的非常棒 又很親和,蒸汽 火車 介紹 親和
2 個月前,4,VR很好玩,好玩
2 個月前,5,VR鬼屋超讚(ᴗ),鬼屋
2 個月前,5,思眉姐姐服務 讓我許久沒來的六福村 多了一點熱情 她的介紹 讓我更加喜歡來到六福村玩,姐姐 服務 六福村 一點 熱情 介紹 喜歡 來到 六福村
2 個月前,5,來六福村 團體結帳時 找服務人員鍾雨芩處理票務的東西 因為不清楚 她們的熱心服務 讓我省下不少的麻煩 謝謝六福村的人員的幫助,六福村 團體 結帳 服務 人員 處理 票務 東西 清楚 熱心 服務 省下 不少 麻煩 謝謝 六福村 人員 幫助
2 個月前,5,,
2 個月前,5,童年的回憶還是一樣刺激好玩,童年 回憶 一樣 刺激 好玩
2 個月前,5,蘇楹筑服務不錯,服務 不錯
2 個月前,5,楹築人很好服務也很好,楹築人 服務
2 個月前,5,蒸汽火車導覽員秋玉姊姊很專業很大方謝謝你們,蒸汽 火車 導覽員 姊姊 專業 大方 謝謝
2 個月前,5,vr太滴媽好玩了,好玩
2 個月前,5,雷射迷宮的楊筑雲非常貼心又很親切服務態度超好整趟體驗很開心 ,雷射 迷宮 貼心 親切 服務 態度 超好 體驗 開心
2 個月前,5,今天玩老油井服務人員博弘服務很好長得也很帥讚喔 ,今天 油井 服務 人員 服務 帥讚
2 個月前,5,"旋轉木馬黃沛瑄好讚
拍很多照好狠",旋轉 木馬 很多
2 個月前,5,旋轉木馬服務人員 讚讚,旋轉 木馬 服務 人員 讚讚
2 個月前,5,"旋轉木馬服務人員黃沛瑄讚讚
幫我們拍好多照片",旋轉 木馬 服務 人員 讚讚 好多 照片
2 個月前,5,摩天輪服務態度很好沅儒 ,摩天輪 服務 態度 沅儒
2 個月前,5,雷射迷宮楊筑雲人超好的玩起來也很開心很謝謝她,雷射 迷宮 玩起來 開心 謝謝
2 個月前,5,雷射迷宮的筑雲服務態度很好非常的親切讓我們玩的很開心 ,雷射 迷宮 服務 態度 親切 開心
2 個月前,5,小時候的回憶,小時候 回憶
2 個月前,5,遊樂園真好玩尤其是古墓謎城的服務員渝婷幽默風趣服務態度非常好,遊樂園 好玩 謎城 服務員 幽默 風趣 服務 態度
2 個月前,5,風景很好服務人員也很好特別是古墓謎城的渝婷長得漂亮又可愛服務一極棒(*ωﾉﾉﾞ ,風景 服務 人員 特別 謎城 漂亮 可愛 服務
2 個月前,5,楹築服務好,楹築 服務
2 個月前,5,園區內的服務人員服務品質很好特別是古墓迷城3D電影的渝婷仔細介紹外還幫忙合照感謝你,園區 服務 人員 服務 品質 特別 古墓 迷城 3D 電影 仔細 介紹 幫忙 合照 感謝
2 個月前,4,"很適合家庭旅遊且方便停車
來看個動物就值回票價了
但裡面的餐廳都需要排隊若有帶小孩子需要提早吃飯不然小孩會餓扁","適合 家庭 旅遊 方便 停車
 動物 值回票價 裡面 餐廳 需要 排隊 小孩子 需要 提早 吃飯 小孩 餓扁"
2 個月前,5,韋錚服務良好讚讚 ,服務 良好 讚讚
2 個月前,5,韋錚服務良好  很棒 超級棒,服務 良好 超級棒
2 個月前,4,充滿回憶的地方,充滿 回憶 地方
2 個月前,5,這個有料 連續五趟,連續
2 個月前,5,蒸汽火車導覽人員秋玉解說超讚,蒸汽 火車 導覽 人員 解說
2 個月前,5,今天參加秋玉的小火車動物導覽很仔細精彩很推薦,今天 參加 火車 動物 導覽 仔細 精彩 推薦
2 個月前,5,魔幻劇場表演很精彩,魔幻 劇場 表演 精彩
2 個月前,5,海盜船 凱文 服務好 細心介紹 讚 ,海盜船 服務好 細心 介紹
2 個月前,5,海盜船凱文很會互動服務好,海盜船 互動 服務
2 個月前,5,票口美珍服務親切很棒,美珍 服務 親切
2 個月前,5,天馬行空服務很好 拍照技術棒設施很好玩 品潔,天馬 行空 服務 拍照 技術棒 設施 好玩
2 個月前,5,天馬行空拍照很棒喔 品潔宏忠熱心服務,天馬行空 拍照 熱心 服務
2 個月前,5,超級好玩的公園有動物和遊樂設施在一起真的很值得一遊希望這個公園在 covid 之後恢復生機請拜訪 55 Hung Chung Tai和Pin Jie對我們真的很熱情幫我們拍了很棒的照片,好玩 公園 動物 遊樂 設施 在一起 值得 希望 公園 之後 恢復 生機 拜訪 熱情 照片
2 個月前,5,星期一去不用排隊非常好玩,星期一 排隊 好玩
2 個月前,5,推薦服務台梅秀的服務發問有問必答態度親切,推薦 服務台 服務 發問 態度 親切
2 個月前,5,昨日驗票口服務人員韋錚拍照技術一流而且很熱情 值得讚賞,昨日 驗票口 服務 人員 拍照 技術 一流 熱情 值得 讚賞
2 個月前,5,魔幻劇場好好看,魔幻 劇場
2 個月前,5,魔幻劇場精彩唷,魔幻 劇場 精彩
2 個月前,5,天馬行空服務人員沛瑄 宏忠 讚讚 ,天馬行空 服務 人員 讚讚
2 個月前,5,天馬宏忠.沛瑄 ,
2 個月前,5,"大怒神的志強超有趣好親切
天馬 宏忠 沛瑄 熱情服務協助拍照 ",大怒神 有趣 親切 天馬 熱情 服務 協助 拍照
2 個月前,5,火山服務員庭瑄 服務很棒不敢搭了 還幫忙帶小朋友下船 還安撫小朋友的情緒 人真的好好,火山 服務員 服務 幫忙 小朋友 安撫 小朋友 情緒 好好
2 個月前,5,火山服務員庭瑄 服務很棒不敢搭了 還幫忙帶小朋友下船 還安撫小朋友的情緒 人真的好好,火山 服務員 服務 幫忙 小朋友 安撫 小朋友 情緒 好好
2 個月前,5,天馬宏忠熱情服務幫我拍照,天馬宏忠 熱情 服務 拍照
2 個月前,5,志強服務熱心 ,服務 熱心
2 個月前,5,志強讚,
2 個月前,5,雷射迷宮 緯凱 服務態度良好 很開心,雷射 迷宮 服務 態度 良好 開心
2 個月前,5,採礦車 雨涵服務很好  ,採礦車 雨涵 服務
2 個月前,5,採礦車 雨涵服務好,採礦車 雨涵 服務
2 個月前,5,服務貼心員志強讚讚 ,服務 貼心員 讚讚
2 個月前,5,"服務態度極佳
志強 棒棒",服務 態度 棒棒
2 個月前,5,"讓我們玩了很多次 刺激
志強",很多 刺激
2 個月前,5,,
2 個月前,5,海怪服務員庭瑄 人超好很貼心的幫我們繫安全帶超讚,海怪 服務員 貼心 安全帶 超讚
2 個月前,5,27那天去玩推售票員芮萱服務的非常好很貼心的大姊姊 ,27 推售票員 服務 貼心 姊姊
2 個月前,5,,
2 個月前,5,"很多好玩的設施
服務人員也很親切",很多 好玩 設施 服務 人員 親切
2 個月前,1,都已經買票了停車還要花錢,買票 停車 花錢
2 個月前,5,記得要善用園區app預約的功能很方便這裡真的是小孩的天堂,記得 善用 園區 預約 功能 方便 這裡 小孩 天堂
2 個月前,5,雷射迷宮 服務員緯凱服務態度超棒讓我們有良好體驗還幫我們拍照 超開心 ,雷射 迷宮 服務員 服務 態度 良好 體驗 拍照 開心
2 個月前,5,雷射迷宮 緯凱服務態度好,雷射 迷宮 服務 態度
2 個月前,5,,
2 個月前,5,火山歷險記服務員庭瑄 很貼心教導我們該如何搭乘設施 人超好,火山歷險記 服務員 貼心 教導 搭乘 設施 超好
